{
  "$schema": "https://ui.logic2b.com/schema/registry-item.json",
  "name": "select",
  "type": "registry:ui",
  "description": "Displays a list of options for the user to pick from, triggered by a button. Use for choosing one value from a longer or dropdown-style list, built on Radix Select.",
  "dependencies": [
    "radix-ui",
    "lucide-react"
  ],
  "registryDependencies": [
    "utils"
  ],
  "files": [
    {
      "path": "ui/select.tsx",
      "type": "registry:ui",
      "content": "\"use client\"\n\nimport * as React from \"react\"\nimport { Select as SelectPrimitive } from \"radix-ui\"\nimport { CheckIcon, ChevronDownIcon, ChevronUpIcon } from \"lucide-react\"\n\nimport { cn } from \"@/lib/utils\"\n\nfunction Select({\n  ...props\n}: React.ComponentProps<typeof SelectPrimitive.Root>) {\n  return <SelectPrimitive.Root data-slot=\"select\" {...props} />\n}\n\nfunction SelectGroup({\n  ...props\n}: React.ComponentProps<typeof SelectPrimitive.Group>) {\n  return <SelectPrimitive.Group data-slot=\"select-group\" {...props} />\n}\n\nfunction SelectValue({\n  ...props\n}: React.ComponentProps<typeof SelectPrimitive.Value>) {\n  return <SelectPrimitive.Value data-slot=\"select-value\" {...props} />\n}\n\nfunction SelectTrigger({\n  className,\n  size = \"default\",\n  children,\n  ...props\n}: React.ComponentProps<typeof SelectPrimitive.Trigger> & {\n  size?: \"sm\" | \"default\"\n}) {\n  return (\n    <SelectPrimitive.Trigger\n      data-slot=\"select-trigger\"\n      data-size={size}\n      className={cn(\n        \"border-input data-[placeholder]:text-muted-foreground [&_svg:not([class*='text-'])]:text-muted-foreground focus-visible:border-ring focus-visible:ring-ring/50 aria-invalid:ring-destructive/20 dark:aria-invalid:ring-destructive/40 aria-invalid:border-destructive dark:bg-input/30 dark:hover:bg-input/50 flex w-fit items-center justify-between gap-2 rounded-md border bg-transparent px-3 py-2 text-sm whitespace-nowrap shadow-xs transition-[color,box-shadow] outline-none focus-visible:ring-[3px] disabled:cursor-not-allowed disabled:opacity-50 data-[size=default]:h-9 data-[size=sm]:h-8 *:data-[slot=select-value]:line-clamp-1 *:data-[slot=select-value]:flex *:data-[slot=select-value]:items-center *:data-[slot=select-value]:gap-2 [&_svg]:pointer-events-none [&_svg]:shrink-0 [&_svg:not([class*='size-'])]:size-4\",\n        className\n      )}\n      {...props}\n    >\n      {children}\n      <SelectPrimitive.Icon asChild>\n        <ChevronDownIcon className=\"size-4 opacity-50\" />\n      </SelectPrimitive.Icon>\n    </SelectPrimitive.Trigger>\n  )\n}\n\nfunction SelectContent({\n  className,\n  children,\n  position = \"popper\",\n  ...props\n}: React.ComponentProps<typeof SelectPrimitive.Content>) {\n  return (\n    <SelectPrimitive.Portal>\n      <SelectPrimitive.Content\n        data-slot=\"select-content\"\n        className={cn(\n          \"bg-popover text-popover-foreground data-[state=open]:animate-in data-[state=closed]:animate-out data-[state=closed]:fade-out-0 data-[state=open]:fade-in-0 data-[state=closed]:zoom-out-95 data-[state=open]:zoom-in-95 data-[side=bottom]:slide-in-from-top-2 data-[side=left]:slide-in-from-right-2 data-[side=right]:slide-in-from-left-2 data-[side=top]:slide-in-from-bottom-2 relative z-50 max-h-(--radix-select-content-available-height) min-w-[8rem] origin-(--radix-select-content-transform-origin) overflow-x-hidden overflow-y-auto rounded-md border shadow-md\",\n          position === \"popper\" &&\n            \"data-[side=bottom]:translate-y-1 data-[side=left]:-translate-x-1 data-[side=right]:translate-x-1 data-[side=top]:-translate-y-1\",\n          className\n        )}\n        position={position}\n        {...props}\n      >\n        <SelectScrollUpButton />\n        <SelectPrimitive.Viewport\n          className={cn(\n            \"p-1\",\n            position === \"popper\" &&\n              \"h-[var(--radix-select-trigger-height)] w-full min-w-[var(--radix-select-trigger-width)] scroll-my-1\"\n          )}\n        >\n          {children}\n        </SelectPrimitive.Viewport>\n        <SelectScrollDownButton />\n      </SelectPrimitive.Content>\n    </SelectPrimitive.Portal>\n  )\n}\n\nfunction SelectLabel({\n  className,\n  ...props\n}: React.ComponentProps<typeof SelectPrimitive.Label>) {\n  return (\n    <SelectPrimitive.Label\n      data-slot=\"select-label\"\n      className={cn(\"text-muted-foreground px-2 py-1.5 text-xs\", className)}\n      {...props}\n    />\n  )\n}\n\nfunction SelectItem({\n  className,\n  children,\n  ...props\n}: React.ComponentProps<typeof SelectPrimitive.Item>) {\n  return (\n    <SelectPrimitive.Item\n      data-slot=\"select-item\"\n      className={cn(\n        \"focus:bg-accent focus:text-accent-foreground [&_svg:not([class*='text-'])]:text-muted-foreground relative flex w-full cursor-default items-center gap-2 rounded-sm py-1.5 pr-8 pl-2 text-sm outline-hidden select-none data-[disabled]:pointer-events-none data-[disabled]:opacity-50 [&_svg]:pointer-events-none [&_svg]:shrink-0 [&_svg:not([class*='size-'])]:size-4 *:[span]:last:flex *:[span]:last:items-center *:[span]:last:gap-2\",\n        className\n      )}\n      {...props}\n    >\n      <span className=\"absolute right-2 flex size-3.5 items-center justify-center\">\n        <SelectPrimitive.ItemIndicator>\n          <CheckIcon className=\"size-4\" />\n        </SelectPrimitive.ItemIndicator>\n      </span>\n      <SelectPrimitive.ItemText>{children}</SelectPrimitive.ItemText>\n    </SelectPrimitive.Item>\n  )\n}\n\nfunction SelectSeparator({\n  className,\n  ...props\n}: React.ComponentProps<typeof SelectPrimitive.Separator>) {\n  return (\n    <SelectPrimitive.Separator\n      data-slot=\"select-separator\"\n      className={cn(\"bg-border pointer-events-none -mx-1 my-1 h-px\", className)}\n      {...props}\n    />\n  )\n}\n\nfunction SelectScrollUpButton({\n  className,\n  ...props\n}: React.ComponentProps<typeof SelectPrimitive.ScrollUpButton>) {\n  return (\n    <SelectPrimitive.ScrollUpButton\n      data-slot=\"select-scroll-up-button\"\n      className={cn(\n        \"flex cursor-default items-center justify-center py-1\",\n        className\n      )}\n      {...props}\n    >\n      <ChevronUpIcon className=\"size-4\" />\n    </SelectPrimitive.ScrollUpButton>\n  )\n}\n\nfunction SelectScrollDownButton({\n  className,\n  ...props\n}: React.ComponentProps<typeof SelectPrimitive.ScrollDownButton>) {\n  return (\n    <SelectPrimitive.ScrollDownButton\n      data-slot=\"select-scroll-down-button\"\n      className={cn(\n        \"flex cursor-default items-center justify-center py-1\",\n        className\n      )}\n      {...props}\n    >\n      <ChevronDownIcon className=\"size-4\" />\n    </SelectPrimitive.ScrollDownButton>\n  )\n}\n\nexport {\n  Select,\n  SelectContent,\n  SelectGroup,\n  SelectItem,\n  SelectLabel,\n  SelectScrollDownButton,\n  SelectScrollUpButton,\n  SelectSeparator,\n  SelectTrigger,\n  SelectValue,\n}\n"
    }
  ],
  "categories": [
    "form"
  ],
  "accessibility": {
    "support": "primitive",
    "pattern": "listbox select",
    "primitive": "Radix Select",
    "keyboard": [
      {
        "keys": [
          "Enter",
          "Space"
        ],
        "action": "Activate the focused control."
      },
      {
        "keys": [
          "ArrowUp",
          "ArrowDown",
          "ArrowLeft",
          "ArrowRight"
        ],
        "action": "Move within the composite control."
      },
      {
        "keys": [
          "Home",
          "End"
        ],
        "action": "Move to the first or last option."
      },
      {
        "keys": [
          "Escape"
        ],
        "action": "Close the open surface and restore focus."
      }
    ],
    "aria": [
      "Manages combobox/listbox/option semantics, selected state and trigger-value linkage."
    ],
    "consumer": [
      "Provide a visible label or aria-label for the trigger."
    ]
  }
}