{
  "$schema": "https://ui.logic2b.com/schema/registry-item.json",
  "name": "input-otp",
  "type": "registry:ui",
  "description": "An accessible one-time-password input with individual character slots and a fake caret, built on input-otp. Use for verification codes (SMS/email/2FA). Parts: InputOTP (root), InputOTPGroup, InputOTPSlot (index), InputOTPSeparator.",
  "dependencies": [
    "input-otp",
    "lucide-react"
  ],
  "registryDependencies": [
    "utils"
  ],
  "files": [
    {
      "path": "ui/input-otp.tsx",
      "type": "registry:ui",
      "content": "\"use client\"\n\nimport * as React from \"react\"\nimport { OTPInput, OTPInputContext } from \"input-otp\"\nimport { MinusIcon } from \"lucide-react\"\n\nimport { cn } from \"@/lib/utils\"\n\nfunction InputOTP({\n  className,\n  containerClassName,\n  ...props\n}: React.ComponentProps<typeof OTPInput>) {\n  return (\n    <OTPInput\n      data-slot=\"input-otp\"\n      containerClassName={cn(\n        \"flex items-center gap-2 has-disabled:opacity-50\",\n        containerClassName\n      )}\n      className={cn(\"disabled:cursor-not-allowed\", className)}\n      {...props}\n    />\n  )\n}\n\nfunction InputOTPGroup({ className, ...props }: React.ComponentProps<\"div\">) {\n  return (\n    <div\n      data-slot=\"input-otp-group\"\n      className={cn(\"flex items-center\", className)}\n      {...props}\n    />\n  )\n}\n\nfunction InputOTPSlot({\n  index,\n  className,\n  ...props\n}: React.ComponentProps<\"div\"> & {\n  index: number\n}) {\n  const inputOTPContext = React.useContext(OTPInputContext)\n  const { char, hasFakeCaret, isActive } = inputOTPContext?.slots[index] ?? {}\n\n  return (\n    <div\n      data-slot=\"input-otp-slot\"\n      data-active={isActive}\n      className={cn(\n        \"data-[active=true]:border-ring data-[active=true]:ring-ring/50 data-[active=true]:aria-invalid:ring-destructive/20 dark:data-[active=true]:aria-invalid:ring-destructive/40 aria-invalid:border-destructive data-[active=true]:aria-invalid:border-destructive dark:bg-input/30 border-input relative flex h-9 w-9 items-center justify-center border-y border-r text-sm shadow-xs transition-all outline-none first:rounded-l-md first:border-l last:rounded-r-md data-[active=true]:z-10 data-[active=true]:ring-[3px]\",\n        className\n      )}\n      {...props}\n    >\n      {char}\n      {hasFakeCaret && (\n        <div className=\"pointer-events-none absolute inset-0 flex items-center justify-center\">\n          <div className=\"animate-caret-blink bg-foreground h-4 w-px duration-1000\" />\n        </div>\n      )}\n    </div>\n  )\n}\n\nfunction InputOTPSeparator({ ...props }: React.ComponentProps<\"div\">) {\n  return (\n    <div data-slot=\"input-otp-separator\" role=\"separator\" {...props}>\n      <MinusIcon />\n    </div>\n  )\n}\n\nexport { InputOTP, InputOTPGroup, InputOTPSlot, InputOTPSeparator }\n"
    }
  ],
  "categories": [
    "form"
  ],
  "accessibility": {
    "support": "primitive",
    "pattern": "one-time-code textbox",
    "primitive": "input-otp",
    "keyboard": [
      {
        "keys": [
          "Backspace"
        ],
        "action": "Clear the current slot and move backward."
      },
      {
        "keys": [
          "ArrowLeft",
          "ArrowRight"
        ],
        "action": "Move between code positions where supported."
      }
    ],
    "aria": [
      "A single input owns the value while visual slots mirror caret/invalid state."
    ],
    "consumer": [
      "Provide a label, autocomplete=one-time-code where appropriate and never rely only on SMS access."
    ]
  },
  "api": {
    "source": "src/ui/input-otp.tsx",
    "exports": [
      {
        "name": "InputOTP",
        "kind": "component",
        "propsType": "React.ComponentProps<typeof OTPInput>"
      },
      {
        "name": "InputOTPGroup",
        "kind": "component",
        "propsType": "React.ComponentProps<\"div\">"
      },
      {
        "name": "InputOTPSlot",
        "kind": "component",
        "propsType": "React.ComponentProps<\"div\"> & { index: number }",
        "props": [
          {
            "name": "index",
            "type": "number",
            "required": true
          }
        ]
      },
      {
        "name": "InputOTPSeparator",
        "kind": "component",
        "propsType": "React.ComponentProps<\"div\">"
      }
    ]
  }
}