{"$schema":"https://ui.logic2b.com/schema/registry-item.json","name":"admin-reservations-01","type":"registry:block","title":"Reservations admin dashboard","description":"A reservations back-office dashboard: a KPI row (today's bookings, guests, occupancy, no-shows) over a bookings table with guest avatars, resource, time, party size, confirmed/held/cancelled status badges, per-row actions, live search and status filter tabs. Use as the admin panel of a booking system.","dependencies":["lucide-react"],"registryDependencies":["utils","avatar","badge","button","card","dropdown-menu","input","table","tabs"],"files":[{"path":"blocks/admin-reservations-01/admin-reservations.tsx","type":"registry:block","content":"\"use client\"\n\nimport * as React from \"react\"\nimport { MoreHorizontalIcon, PlusIcon, SearchIcon } from \"lucide-react\"\n\nimport { cn } from \"@/lib/utils\"\nimport { Avatar, AvatarFallback } from \"@/components/ui/avatar\"\nimport { Badge } from \"@/components/ui/badge\"\nimport { Button } from \"@/components/ui/button\"\nimport {\n  Card,\n  CardContent,\n  CardDescription,\n  CardHeader,\n  CardTitle,\n} from \"@/components/ui/card\"\nimport {\n  DropdownMenu,\n  DropdownMenuContent,\n  DropdownMenuItem,\n  DropdownMenuLabel,\n  DropdownMenuSeparator,\n  DropdownMenuTrigger,\n} from \"@/components/ui/dropdown-menu\"\nimport { Input } from \"@/components/ui/input\"\nimport {\n  Table,\n  TableBody,\n  TableCell,\n  TableHead,\n  TableHeader,\n  TableRow,\n} from \"@/components/ui/table\"\nimport { Tabs, TabsContent, TabsList, TabsTrigger } from \"@/components/ui/tabs\"\n\ntype BookingStatus = \"confirmed\" | \"held\" | \"cancelled\"\ntype Reservation = {\n  id: string\n  guest: string\n  email: string\n  resource: string\n  time: string\n  party: number\n  status: BookingStatus\n}\n\nconst KPIS = [\n  { label: \"Today's bookings\", value: \"38\" },\n  { label: \"Guests\", value: \"112\" },\n  { label: \"Occupancy\", value: \"82%\" },\n  { label: \"No-shows\", value: \"3\" },\n]\n\nconst RESERVATIONS: Reservation[] = [\n  { id: \"r1\", guest: \"Olivia Martin\", email: \"olivia@example.com\", resource: \"Window table for 4\", time: \"19:00\", party: 4, status: \"confirmed\" },\n  { id: \"r2\", guest: \"Jackson Lee\", email: \"jackson@example.com\", resource: \"Deluxe room 101\", time: \"15:00\", party: 2, status: \"held\" },\n  { id: \"r3\", guest: \"Isabella Nguyen\", email: \"isabella@example.com\", resource: \"Workshop seat\", time: \"10:30\", party: 1, status: \"confirmed\" },\n  { id: \"r4\", guest: \"William Kim\", email: \"william@example.com\", resource: \"Detailing bay\", time: \"13:00\", party: 1, status: \"cancelled\" },\n  { id: \"r5\", guest: \"Sofia Davis\", email: \"sofia@example.com\", resource: \"Window table for 4\", time: \"20:30\", party: 3, status: \"confirmed\" },\n  { id: \"r6\", guest: \"Liam Johnson\", email: \"liam@example.com\", resource: \"Deluxe room 101\", time: \"18:00\", party: 2, status: \"held\" },\n]\n\nconst STATUS_VARIANT: Record<BookingStatus, \"default\" | \"secondary\" | \"outline\"> = {\n  confirmed: \"default\",\n  held: \"secondary\",\n  cancelled: \"outline\",\n}\n\nconst TABS: { value: BookingStatus | \"all\"; label: string }[] = [\n  { value: \"all\", label: \"All\" },\n  { value: \"confirmed\", label: \"Confirmed\" },\n  { value: \"held\", label: \"Held\" },\n  { value: \"cancelled\", label: \"Cancelled\" },\n]\n\nconst initials = (name: string) =>\n  name\n    .split(\" \")\n    .map((p) => p[0])\n    .slice(0, 2)\n    .join(\"\")\n\nexport function AdminReservations({\n  className,\n  ...props\n}: React.ComponentProps<\"div\">) {\n  const [query, setQuery] = React.useState(\"\")\n  const [status, setStatus] = React.useState<BookingStatus | \"all\">(\"all\")\n\n  const filtered = RESERVATIONS.filter((r) => {\n    const matchesStatus = status === \"all\" || r.status === status\n    const q = query.toLowerCase()\n    const matchesQuery =\n      r.guest.toLowerCase().includes(q) || r.resource.toLowerCase().includes(q)\n    return matchesStatus && matchesQuery\n  })\n\n  return (\n    <div className={cn(\"mx-auto w-full max-w-5xl px-6 py-10\", className)} {...props}>\n      <div className=\"mb-6 flex flex-col gap-3 sm:flex-row sm:items-center sm:justify-between\">\n        <div className=\"flex flex-col gap-1\">\n          <h1 className=\"font-heading text-2xl font-bold tracking-tight\">\n            Reservations\n          </h1>\n          <p className=\"text-muted-foreground text-sm\">\n            Today · Tuesday, July 14 — manage bookings across every resource.\n          </p>\n        </div>\n        <Button>\n          <PlusIcon className=\"size-4\" />\n          New booking\n        </Button>\n      </div>\n\n      <div className=\"mb-6 grid gap-4 sm:grid-cols-2 lg:grid-cols-4\">\n        {KPIS.map((kpi) => (\n          <Card key={kpi.label}>\n            <CardHeader className=\"pb-2\">\n              <CardDescription>{kpi.label}</CardDescription>\n              <CardTitle className=\"text-2xl tabular-nums\">{kpi.value}</CardTitle>\n            </CardHeader>\n          </Card>\n        ))}\n      </div>\n\n      <Tabs value={status} onValueChange={(v) => setStatus(v as BookingStatus | \"all\")}>\n      <Card>\n        <CardHeader className=\"flex flex-col gap-4 lg:flex-row lg:items-center lg:justify-between\">\n          <TabsList>\n            {TABS.map((tab) => (\n              <TabsTrigger key={tab.value} value={tab.value}>\n                {tab.label}\n              </TabsTrigger>\n            ))}\n          </TabsList>\n          <div className=\"relative\">\n            <SearchIcon className=\"text-muted-foreground absolute top-2.5 left-2.5 size-4\" />\n            <Input\n              value={query}\n              onChange={(e) => setQuery(e.target.value)}\n              placeholder=\"Search guests or resources...\"\n              className=\"w-full pl-8 sm:w-[260px]\"\n              aria-label=\"Search reservations\"\n            />\n          </div>\n        </CardHeader>\n        <CardContent>\n          {/* Filter tabs need a panel per value so each trigger's aria-controls\n              resolves; the filtered table lives in the active panel. */}\n          {TABS.map((tab) => (\n            <TabsContent\n              key={tab.value}\n              value={tab.value}\n              forceMount\n              className={cn(\"mt-0\", tab.value !== status && \"hidden\")}\n            >\n              {tab.value === status && (\n          <Table>\n            <TableHeader>\n              <TableRow>\n                <TableHead>Guest</TableHead>\n                <TableHead>Resource</TableHead>\n                <TableHead>Time</TableHead>\n                <TableHead className=\"hidden sm:table-cell\">Party</TableHead>\n                <TableHead>Status</TableHead>\n                <TableHead>\n                  <span className=\"sr-only\">Actions</span>\n                </TableHead>\n              </TableRow>\n            </TableHeader>\n            <TableBody>\n              {filtered.map((r) => (\n                <TableRow key={r.id}>\n                  <TableCell>\n                    <div className=\"flex items-center gap-2\">\n                      <Avatar className=\"size-7\">\n                        <AvatarFallback className=\"text-xs\">\n                          {initials(r.guest)}\n                        </AvatarFallback>\n                      </Avatar>\n                      <div className=\"min-w-0\">\n                        <p className=\"truncate text-sm font-medium\">{r.guest}</p>\n                        <p className=\"text-muted-foreground truncate text-xs\">\n                          {r.email}\n                        </p>\n                      </div>\n                    </div>\n                  </TableCell>\n                  <TableCell className=\"text-sm\">{r.resource}</TableCell>\n                  <TableCell className=\"tabular-nums\">{r.time}</TableCell>\n                  <TableCell className=\"hidden sm:table-cell tabular-nums\">\n                    {r.party}\n                  </TableCell>\n                  <TableCell>\n                    <Badge variant={STATUS_VARIANT[r.status]}>{r.status}</Badge>\n                  </TableCell>\n                  <TableCell>\n                    <DropdownMenu>\n                      <DropdownMenuTrigger asChild>\n                        <Button\n                          variant=\"ghost\"\n                          size=\"icon\"\n                          aria-label={`Actions for ${r.guest}`}\n                        >\n                          <MoreHorizontalIcon className=\"size-4\" />\n                        </Button>\n                      </DropdownMenuTrigger>\n                      <DropdownMenuContent align=\"end\">\n                        <DropdownMenuLabel>Actions</DropdownMenuLabel>\n                        <DropdownMenuItem>View details</DropdownMenuItem>\n                        <DropdownMenuItem>Check in</DropdownMenuItem>\n                        <DropdownMenuSeparator />\n                        <DropdownMenuItem variant=\"destructive\">Cancel</DropdownMenuItem>\n                      </DropdownMenuContent>\n                    </DropdownMenu>\n                  </TableCell>\n                </TableRow>\n              ))}\n              {filtered.length === 0 && (\n                <TableRow>\n                  <TableCell colSpan={6} className=\"text-muted-foreground h-24 text-center\">\n                    No reservations found.\n                  </TableCell>\n                </TableRow>\n              )}\n            </TableBody>\n          </Table>\n              )}\n            </TabsContent>\n          ))}\n        </CardContent>\n      </Card>\n      </Tabs>\n    </div>\n  )\n}\n"}],"categories":["application"]}