{"$schema":"https://ui.logic2b.com/schema/registry-item.json","name":"chart-bar-02","type":"registry:block","title":"Bar Chart - Horizontal","description":"A horizontal bar chart with a single series and category labels on the Y axis. Use it when category names are long or there are many categories.","dependencies":["recharts"],"registryDependencies":["card","chart"],"files":[{"path":"charts/chart-bar-02.tsx","type":"registry:block","content":"import { Bar, BarChart, CartesianGrid, XAxis, YAxis } from \"recharts\"\n\nimport {\n  Card,\n  CardContent,\n  CardDescription,\n  CardHeader,\n  CardTitle,\n} from \"@/components/ui/card\"\nimport {\n  ChartContainer,\n  ChartTooltip,\n  ChartTooltipContent,\n  type ChartConfig,\n} from \"@/components/ui/chart\"\n\nconst chartData = [\n  { month: \"January\", desktop: 186 },\n  { month: \"February\", desktop: 305 },\n  { month: \"March\", desktop: 237 },\n  { month: \"April\", desktop: 73 },\n  { month: \"May\", desktop: 209 },\n  { month: \"June\", desktop: 214 },\n]\n\nconst chartConfig = {\n  desktop: {\n    label: \"Desktop\",\n    color: \"var(--chart-1)\",\n  },\n} satisfies ChartConfig\n\nexport default function ChartBar02() {\n  return (\n    <Card>\n      <CardHeader>\n        <CardTitle>Bar Chart - Horizontal</CardTitle>\n        <CardDescription>January - June 2024</CardDescription>\n      </CardHeader>\n      <CardContent>\n        <ChartContainer config={chartConfig}>\n          <BarChart\n            accessibilityLayer\n            data={chartData}\n            layout=\"vertical\"\n            margin={{ left: -20 }}\n          >\n            <CartesianGrid horizontal={false} />\n            <XAxis type=\"number\" dataKey=\"desktop\" hide />\n            <YAxis\n              dataKey=\"month\"\n              type=\"category\"\n              tickLine={false}\n              axisLine={false}\n              tickMargin={10}\n              tickFormatter={(value) => value.slice(0, 3)}\n            />\n            <ChartTooltip\n              cursor={false}\n              content={<ChartTooltipContent indicator=\"line\" />}\n            />\n            <Bar dataKey=\"desktop\" fill=\"var(--color-desktop)\" radius={4} />\n          </BarChart>\n        </ChartContainer>\n      </CardContent>\n    </Card>\n  )\n}\n"}],"categories":["charts","charts-bar"]}