{"$schema":"https://ui.logic2b.com/schema/registry-item.json","name":"navbar-01","type":"registry:block","title":"Marketing navbar","description":"A sticky top navigation bar with a logo, inline links, sign-in and CTA buttons, and a mobile menu button. Use as a marketing site header.","dependencies":["lucide-react"],"registryDependencies":["button"],"files":[{"path":"blocks/navbar-01/navbar.tsx","type":"registry:block","content":"import * as React from \"react\"\nimport { MenuIcon } from \"lucide-react\"\n\nimport { cn } from \"@/lib/utils\"\nimport { Button } from \"@/components/ui/button\"\n\nconst links = [\n  { label: \"Features\", href: \"#\" },\n  { label: \"Pricing\", href: \"#\" },\n  { label: \"Docs\", href: \"#\" },\n  { label: \"Blog\", href: \"#\" },\n]\n\nfunction LogoMark(props: React.ComponentProps<\"svg\">) {\n  return (\n    <svg viewBox=\"0 0 523.83 536.87\" fill=\"currentColor\" aria-hidden=\"true\" {...props}>\n      <path d=\"M403.46,202.16c-60.83,93.91-71.45,143.92-44.45,209.15,10.99,26.54,32.1,55.89,54.35,75.57,17.76,15.71,20.23,25.12,10.04,38.19-6.97,8.93-14.31,13.01-20.71,11.49-1.93-.46-11.87-6.23-22.07-12.8-49.82-32.2-90.43-44.39-138.3-41.53-34.25,2.04-62.31,10.2-110.19,32.03-44.52,20.29-58.65,24.55-71.19,21.36-2.74-.68-7.96-3.89-11.61-7.11-12.97-11.47-12.61-23.15,2.18-70.64,20.34-65.24,24.79-89.78,22.59-124.35-3.01-47.65-18.68-83.85-56.15-129.68-8.96-10.98-16.82-21.9-17.47-24.28-1.68-6.18,1.04-12.15,9.37-20.45,12.46-12.4,19.13-10.83,46.17,10.87,54.55,43.72,121,57.77,174.32,36.81,22.68-8.93,57.22-30.53,88.51-55.36,35.79-28.4,63.48-54.57,109.37-103.36C464.76,9.19,471.58,3.53,484.96.84c11.09-2.22,17.42-.26,27.32,8.49,7.06,6.23,9.04,8.96,10.41,14.17,4.51,17.46-3.75,33.37-36.84,70.85-29.02,32.88-60.73,74.38-82.39,107.82h0Z\" />\n    </svg>\n  )\n}\n\nexport function Navbar({\n  className,\n  ...props\n}: React.ComponentProps<\"header\">) {\n  return (\n    <header\n      className={cn(\n        \"bg-background/80 sticky top-0 z-50 w-full border-b backdrop-blur\",\n        className\n      )}\n      {...props}\n    >\n      <div className=\"mx-auto flex h-14 w-full max-w-6xl items-center gap-6 px-6\">\n        <a href=\"#\" className=\"flex items-center gap-2 font-semibold\">\n          <LogoMark className=\"size-5\" />\n          logic2b\n        </a>\n        <nav className=\"text-muted-foreground hidden flex-1 items-center gap-5 text-sm md:flex\">\n          {links.map((link) => (\n            <a\n              key={link.label}\n              href={link.href}\n              className=\"hover:text-foreground transition-colors\"\n            >\n              {link.label}\n            </a>\n          ))}\n        </nav>\n        <div className=\"ml-auto flex items-center gap-2\">\n          <Button variant=\"ghost\" size=\"sm\" className=\"hidden sm:inline-flex\">\n            Sign in\n          </Button>\n          <Button size=\"sm\">Get started</Button>\n          <Button\n            variant=\"ghost\"\n            size=\"icon\"\n            className=\"md:hidden\"\n            aria-label=\"Open menu\"\n          >\n            <MenuIcon className=\"size-5\" />\n          </Button>\n        </div>\n      </div>\n    </header>\n  )\n}\n"}],"categories":["marketing"]}