{
  "$schema": "https://ui.logic2b.com/schema/registry-item.json",
  "name": "pagination",
  "type": "registry:ui",
  "description": "Renders page navigation links for paginated content, such as tables or search results.",
  "dependencies": [
    "lucide-react"
  ],
  "registryDependencies": [
    "utils",
    "button"
  ],
  "files": [
    {
      "path": "ui/pagination.tsx",
      "type": "registry:ui",
      "content": "import * as React from \"react\"\nimport { ChevronLeft, ChevronRight, MoreHorizontal } from \"lucide-react\"\nimport type { VariantProps } from \"class-variance-authority\"\n\nimport { cn } from \"@/lib/utils\"\nimport { buttonVariants } from \"@/components/ui/button\"\n\nfunction Pagination({ className, ...props }: React.ComponentProps<\"nav\">) {\n  return (\n    <nav\n      role=\"navigation\"\n      aria-label=\"pagination\"\n      data-slot=\"pagination\"\n      className={cn(\"mx-auto flex w-full justify-center\", className)}\n      {...props}\n    />\n  )\n}\n\nfunction PaginationContent({\n  className,\n  ...props\n}: React.ComponentProps<\"ul\">) {\n  return (\n    <ul\n      data-slot=\"pagination-content\"\n      className={cn(\"flex flex-row items-center gap-1\", className)}\n      {...props}\n    />\n  )\n}\n\nfunction PaginationItem({ ...props }: React.ComponentProps<\"li\">) {\n  return <li data-slot=\"pagination-item\" {...props} />\n}\n\ntype PaginationLinkProps = {\n  isActive?: boolean\n} & Pick<VariantProps<typeof buttonVariants>, \"size\"> &\n  React.ComponentProps<\"a\">\n\nfunction PaginationLink({\n  className,\n  isActive,\n  size = \"icon\",\n  ...props\n}: PaginationLinkProps) {\n  return (\n    <a\n      aria-current={isActive ? \"page\" : undefined}\n      data-slot=\"pagination-link\"\n      data-active={isActive}\n      className={cn(\n        buttonVariants({\n          variant: isActive ? \"outline\" : \"ghost\",\n          size,\n        }),\n        className\n      )}\n      {...props}\n    />\n  )\n}\n\nfunction PaginationPrevious({\n  className,\n  ...props\n}: React.ComponentProps<typeof PaginationLink>) {\n  return (\n    <PaginationLink\n      aria-label=\"Go to previous page\"\n      size=\"default\"\n      className={cn(\"gap-1 px-2.5 sm:pl-2.5\", className)}\n      {...props}\n    >\n      <ChevronLeft />\n      <span className=\"hidden sm:block\">Previous</span>\n    </PaginationLink>\n  )\n}\n\nfunction PaginationNext({\n  className,\n  ...props\n}: React.ComponentProps<typeof PaginationLink>) {\n  return (\n    <PaginationLink\n      aria-label=\"Go to next page\"\n      size=\"default\"\n      className={cn(\"gap-1 px-2.5 sm:pr-2.5\", className)}\n      {...props}\n    >\n      <span className=\"hidden sm:block\">Next</span>\n      <ChevronRight />\n    </PaginationLink>\n  )\n}\n\nfunction PaginationEllipsis({\n  className,\n  ...props\n}: React.ComponentProps<\"span\">) {\n  return (\n    <span\n      aria-hidden\n      data-slot=\"pagination-ellipsis\"\n      className={cn(\"flex size-9 items-center justify-center\", className)}\n      {...props}\n    >\n      <MoreHorizontal className=\"size-4\" />\n      <span className=\"sr-only\">More pages</span>\n    </span>\n  )\n}\n\nexport {\n  Pagination,\n  PaginationContent,\n  PaginationLink,\n  PaginationItem,\n  PaginationPrevious,\n  PaginationNext,\n  PaginationEllipsis,\n}\n"
    }
  ],
  "categories": [
    "navigation"
  ],
  "accessibility": {
    "support": "consumer",
    "pattern": "pagination navigation",
    "primitive": "HTML nav/anchor/button",
    "keyboard": [
      {
        "keys": [
          "Enter",
          "Space"
        ],
        "action": "Activate the focused control."
      }
    ],
    "aria": [
      "The root is a navigation landmark and the active page can expose aria-current=page."
    ],
    "consumer": [
      "Give the nav an aria-label and accessible labels to previous/next/icon-only links."
    ]
  },
  "api": {
    "source": "src/ui/pagination.tsx",
    "exports": [
      {
        "name": "Pagination",
        "kind": "component",
        "propsType": "React.ComponentProps<\"nav\">"
      },
      {
        "name": "PaginationContent",
        "kind": "component",
        "propsType": "React.ComponentProps<\"ul\">"
      },
      {
        "name": "PaginationLink",
        "kind": "component",
        "propsType": "PaginationLinkProps",
        "props": [
          {
            "name": "isActive",
            "type": "boolean",
            "required": false
          },
          {
            "name": "size",
            "type": "null | \"default\" | \"sm\" | \"lg\" | \"icon\"",
            "required": false,
            "default": "\"icon\""
          }
        ]
      },
      {
        "name": "PaginationItem",
        "kind": "component",
        "propsType": "React.ComponentProps<\"li\">"
      },
      {
        "name": "PaginationPrevious",
        "kind": "component",
        "propsType": "React.ComponentProps<typeof PaginationLink>"
      },
      {
        "name": "PaginationNext",
        "kind": "component",
        "propsType": "React.ComponentProps<typeof PaginationLink>"
      },
      {
        "name": "PaginationEllipsis",
        "kind": "component",
        "propsType": "React.ComponentProps<\"span\">"
      }
    ]
  }
}